user_input,retrieved_contexts,response,reference,answer_relevancy,faithfulness,context_precision,context_recall
Qual é a data limite para ajuste de matrículas em disciplinas do 1º quadrimestre de 2025?,"['CALENDÁRIO DE PROCEDIMENTOS ADMINISTRATIVO -ACADÊMICOS DA GRADUAÇÃO – 2025    Atualizado em 20.03.2025   1   JANEIR O  De 06/01 a 07/02  Lançamento de conceitos de 2024.3   De 09 a 23  Avaliação de Disciplinas 3º quadrimestre 2024   30 (12h) a 31 (23h59)  Ajuste de Matrículas em Disciplinas - 1º quadrimestre de 2025   De 01 a 31  Solicitação de Colação de Grau de Fevereiro – exclusivo para concluintes até 2024.2**   31 Colação de Grau – exclusivo para concluintes até o 2º quadrimestre de 2024   (**) Para solicitar Colação de Grau neste período, é necessário ter concluído todas as exigências previstas nos  Projetos Pedagógicos dos cursos até a finalização do quadrimestre de 202 4.2, incluindo', '-se a validação de atividades  complementares e extensionistas .    FEVEREIRO']","A data limite para ajuste de matrículas em disciplinas do 1º quadrimestre de 2025 é 31 de janeiro de 2025, até às 23h59.","A data limite para ajuste de matrículas em disciplinas do 1º quadrimestre de 2025 é 31 de janeiro de 2025, até às 23h59.",0.9999999999999998,0.5,0.9999999999,0.0
Qual é a data de início das aulas para veteranos no 1º quadrimestre?,"['complementares e extensionistas .    FEVEREIRO   01 Conclusão do 3º quadrimestre de 2024   De 0 3 a 05 Solicitação excepcional de matrícula em disciplina - 1º quadrimestre de 2025   De 0 4 a 10 Solicitação do regime de guarda religiosa - 1º quadrimestre de 2025   De 03 a 04 Solicitação de Matrícula – Aluno Especial  - 1º quadrimestre de 2025   De 10 a 24  Avaliação de Disciplinas 3º quadrimestre 2024   10 Início das Aulas  - 1º quadrimestre (veteranos)   De 10 a 14  Solicitação de matr ícula em Trabalho de Graduação  das Engenharias , Trabalho  de Conclusão  de Curso de BRI /BPP/BPT e Monografia do BCE   De 10 a 18  Solicitação de Revisão de Conceito e de Ins trumentos Avaliativos (ref. 2024', '.3)  De 10 a 16  Solicitação de Cancelamento de Disciplinas']",O início das aulas para veteranos no 1º quadrimestre é no dia 10 de fevereiro de 2025.,O início das aulas para veteranos no 1º quadrimestre é no dia 10 de fevereiro de 2025.,0.9592356610696252,0.0,0.9999999999,0.0
Quais são as datas para a Solicitação de Cancelamento de Disciplinas?,"['De 10 a 16  Solicitação de Cancelamento de Disciplinas   De 17 a 21  Solicitação de Aproveitamento de Disciplina como Livre Escolha   De 17 a 21  Solicitação de Equivalência de Disciplina   18 (12h) a 19 (23h59 ) Reajuste de Matrículas em Disciplinas  - 1º quadrimestre de 202 5  28 Colação de Grau – exclusivo para concluintes até o 2º quadrimestre de 2024   De 01 a 28  Solicitação de Colação de Grau de Março – exclusivo para concluintes até 2024.2*   (*) Para solicitar Colação de Grau  neste período, é necessário ter concluído todas as exigências previstas nos  Projetos Pedagógicos dos cursos até a finalização do quadrimestre de 202 4.2, incluindo -se a validação de atividades  complementare', 's e extensionistas .    MARÇO   De 06 a 13  Lançamento de conceitos da recuperação (2024.3)']",As datas para a Solicitação de Cancelamento de Disciplinas são de 10 a 16.,As datas para a Solicitação de Cancelamento de Disciplinas são de 10 a 16.,1.0,1.0,0.9999999999,1.0
Quais são as datas para a solicitação de Colação de Grau em março?,"['MARÇO   De 06 a 13  Lançamento de conceitos da recuperação (2024.3)   De 14 a 18 Inscrições para os Cursos de Formação Específica – válida para 2025.2   De 17 a 31  Avaliação de Cursos   De 14 a 21  Solicitação de Revisão de Conceito e de Instrumentos Avaliativos (ref. 2024.3, pós REC)   27 (12h) a 31(23h59)  Matrículas para o 2º quadrimestre de 2025   De 01 a 31  Solicitação de Colação de Grau de Abril – exclusivo para concluintes até 2024.3*   23 Fim do prazo para Trancamento de matrícula sem justificativa   28 Colação de Grau – exclusivo para concluintes até o 2º quadrimestre de 2024    (*) Para solicitar Colação de Grau  neste período, é necessário ter concluído todas as exigências previ', 'stas nos']",A solicitação de Colação de Grau em março pode ser feita de 01 a 31 de março e é exclusiva para concluintes até 2024.3.,A solicitação de Colação de Grau em março pode ser feita de 01 a 31 de março e é exclusiva para concluintes até 2024.3.,0.7819814770244087,1.0,0.9999999999,0.0
Qual é o prazo para a finalização dos Projetos Pedagógicos dos cursos?,"['Projetos Pedagógicos dos cursos até a finalização do quadrimestre de 202 4.3, incluindo -se a validação de atividades  complementares e extensionistas .']",O prazo para a finalização dos Projetos Pedagógicos dos cursos é até a finalização do quadrimestre de 2024.3.,O prazo para a finalização dos Projetos Pedagógicos dos cursos é até a finalização do quadrimestre de 2024.3.,0.9999999999999993,1.0,0.9999999999,1.0
Qual é o período para a solicitação de Colação de Grau de Maio para concluintes até 2024.3?,"['CALENDÁRIO DE PROCEDIMENTOS ADMINISTRATIVO -ACADÊMICOS DA GRADUAÇÃO – 2025    Atualizado em 20.03.2025   2   ABRIL   De 01 a 30  Solicitação de Colação de Grau de Maio – exclusivo para concluintes até 2024.3(*)   29 Colação de Grau  – exclusivo para concluintes até o  3º quadrimestre de 202 4  (*)Para  solicitar Colação de Grau  neste período, é necessário ter concluído todas as exigências previstas nos Projetos  Pedagógicos dos cursos até a fi nalização do quadrimestre de 2024 .3, incluindo -se a validação de atividades  complementares e extensionistas .    MAIO   De 01 a 31  Solicitação de Colação de Grau de Junho – exclusivo para concluintes até 2025.1, que não  dependam dos conceitos de', 'recuperação**   12 a 16  Inscrições para Troca de Turno - válida para o 3º quadrimestre de 2025(*)']",O período para a solicitação de Colação de Grau de Maio para concluintes até 2024.3 é de 01 a 30 de abril de 2025.,O período para a solicitação de Colação de Grau de Maio para concluintes até 2024.3 é de 01 a 30 de abril de 2025.,0.9999999999999998,1.0,0.9999999999,1.0
Qual é a data para a conclusão do 1º quadrimestre de 2025?,"['12 a 16  Inscrições para Troca de Turno - válida para o 3º quadrimestre de 2025(*)   De 12 a 20  Lançamento de conceitos do 1º quadrimestre de 202 5  17 Conclusão do 1º quadrimestre de 202 5  21 (12h) a 22  (23h59)  Ajuste de Matrículas em Disciplinas - 2º quadrimestre 202 5  De 23 a 26  Solicitação excepcional de matrícula em disciplina - 2º quadrimestre de 2025   De 26 a 27  Solicitação de Matrícula – Aluno Especial - 2º quadrimestre de 2025   De 2 6 a 30 Solicitação do regime de guarda religiosa - 2º quadrimestre de 2025   30 Colação de Grau – exclusivo para concluint es até o 3º quadrimestre de 2024   (*) A troca de turno será considerada para fins de classificação, somente a partir do p', 'eríodo de solicitação de  Matrículas em Disciplinas r eferente ao quadrimestre 2025.3']",A conclusão do 1º quadrimestre de 2025 será no dia 17.,A conclusão do 1º quadrimestre de 2025 será no dia 17.,0.9526613806536164,1.0,0.9999999999,1.0
Qual é o período para solicitar Colação de Grau para concluintes até 2025.1?,"['Matrículas em Disciplinas r eferente ao quadrimestre 2025.3   (**) Para solicitar Colação de Grau  neste período, é necessário ter concluído todas as exigências previstas nos Projetos  Pedagógicos dos cursos até a finalização do quadrimestre de 202 5.1, incluindo -se a validação de atividades  complementares e extensionistas .    JUNHO   De 01 a 30  Solicitação de Colação de Grau de Julho – exclusivo para concluintes até 2025.1*   02 Início das Aulas - 2º quadrimestre (ingressantes e veteranos)   De 02 a 06  Solicitação de matrícula em Trabalho de Graduação das Engenharias, Trabalho de Conclusão de  Curso de BRI, BPP e BPT, e Monografia do BCE   De 02 a 08  Solicitação de Cancelamento de Dis', 'ciplinas']",O período para solicitar Colação de Grau para concluintes até 2025.1 é de 01 a 30 de junho.,O período para solicitar Colação de Grau para concluintes até 2025.1 é de 01 a 30 de junho.,0.9999999999999994,1.0,0.9999999999,1.0
Quais são as datas para a solicitação de cancelamento de disciplinas?,"['De 02 a 08  Solicitação de Cancelamento de Disciplinas   De 02 a 10  Solicitação de Revisão de Conceito e de Instrumentos Avaliativos (ref. 2025.1)   De 02 a 16  Avaliação de Discip linas 1º quadrimestre de 2024   De 09 a 13  Solicitação de Aproveitamento de Disciplina como Livre Escolha   De 09 a 13  Solicitação de Equivalência de Disciplina   10 (12h) a 11  (23h59 ) Reajuste de Matrículas em Disci plinas - 2º quadrimestre de 2025   De 23 a 29  Lançamento de conceitos da recuperação (2025.1)   De 26 a 30  Inscrições para os Cursos de Form ação Específica – válida para 2025.3  27 Colação de Grau – exclusivo para concluintes até 2025.1, que não dependam dos conceitos de  recuperação**']",As datas para a solicitação de cancelamento de disciplinas são de 02 a 08.,As datas para a solicitação de cancelamento de disciplinas são de 02 a 08.,1.0,1.0,0.9999999999,1.0
Qual é o período para solicitar Revisão de Conceito e de Instrumentos Avaliativos?,"['recuperação**   De 30/06 a 07/07  Solicitação de Revisão de Conceito e de Instrumentos Avaliativos (ref. 2025.1, pós REC)    (*) Para solicitar Colação de Grau  neste período, é necessário ter concluído todas as exigências previstas nos Projetos  Pedagógicos dos cursos até a finalização do quadrimestre de 202 5.1, incluindo -se a validação de atividades  complementares e extensionistas .']",O período para solicitar Revisão de Conceito e de Instrumentos Avaliativos é de 30/06 a 07/07.,O período para solicitar Revisão de Conceito e de Instrumentos Avaliativos é de 30/06 a 07/07.,0.9999999999999997,1.0,0.9999999999,1.0
Qual é o prazo final para a solicitação de Colação de Grau de Agosto?,"['CALENDÁRIO DE PROCEDIMENTOS ADMINISTRATIVO -ACADÊMICOS DA GRADUAÇÃO – 2025    Atualizado em 20.03.2025   3   JULHO   De 01 a 31  Solicitação de Colação de Grau de Agosto – exclusivo para concluintes até 2025.1*   13 Fim do prazo para trancamento de matrícula sem justificativa   De 15 a 19  Inscrição para Transferência Externa   17 (12h) a 21(23h59 ) Matrículas para o 3º quadrimestre de 2025   29 Colação de Grau – exclusivo para concluint es até o 1º quadrimestre de 2025   (*) Para solicitar Colação de Grau  neste período, é necessário ter concluído todas as exigências previstas nos  Projetos Pedagógicos dos cursos até a fin alização do quadrimestre de 202 5.1, incluindo -se a validação de at', 'ividades  complementares e extensionistas .    AGOSTO']",O prazo final para a solicitação de Colação de Grau de Agosto é de 01 a 31 de julho de 2025.,O prazo final para a solicitação de Colação de Grau de Agosto é de 01 a 31 de julho de 2025.,0.9999999999999994,1.0,0.9999999999,1.0
Qual é o período para solicitar a Colação de Grau de Setembro?,"['complementares e extensionistas .    AGOSTO   De 01 a 31  Solicitação de Colação de Grau de Setembro – exclusivo para concluintes até 2025.2, que não  dependam dos conceitos de recuperação**   De 26/08 a 02/09  Lançamento de conceitos do 2º quadrimestre de 2024   29 Conclusão do 2º quadrimestre de 2024   29 Colação de Grau – exclusivo para concluintes até o 1º quadrimestre de 2025   (*) Para solicitar Colação de Grau  neste período, é necessário ter concluído todas as exigências previstas nos  Projetos Pedagógicos dos cursos até a finalização do quadrimestre de 2025.2, incluindo -se a validação de atividades  complementares e extensionistas     SETEMBRO   De 01 a 30  Solicitação de Colação d', 'e Grau de Outubro – exclusivo para concluintes até 2025.2*']",O período para solicitar a Colação de Grau de Setembro é de 01 a 31 de agosto.,O período para solicitar a Colação de Grau de Setembro é de 01 a 31 de agosto.,0.9999999999999996,1.0,0.9999999999,0.0
Quais são as datas para a solicitação de colação de grau de outubro?,"['De 01 a 30  Solicitação de Colação de Grau de Outubro – exclusivo para concluintes até 2025.2*   03 (12h) a 04 (23h59)  Ajuste de Matrículas em Disciplinas - 3º quadrimestre   De 05 a 08  Solicitação excepcional de matrícula em disciplina - 3º quadrimestre de 2025   De 08 a 09  Solicitação de Matrícula – Aluno Especial - 3º quadrimestre de 2025   De 0 8 a 12 Solicitação do regime de guarda religiosa - 3º quadrimestre de 2025   15 Início das  Aulas - 3º quadrimestre de 2025   De 15 a 19  Solicitação de matrícula em Trabalho de Graduação das Engenharias, Trabalho de Conclusão  de Curso de BRI, BPP e BPT, e Monografia do BCE   De 15 a 21  Solicitação de Cancelamento de Disciplinas   De 15 a 23', 'Solicitação de Revisão de Conceito e de Instrumentos Avaliativos (ref. 2025.2)']",As datas para a solicitação de colação de grau de outubro são de 01 a 30.,As datas para a solicitação de colação de grau de outubro são de 01 a 30.,0.9999999999999999,1.0,0.9999999999,1.0
Quais são as datas para a Solicitação de Revisão de Conceito e de Instrumentos Avaliativos?,"['De 15 a 23  Solicitação de Revisão de Conceito e de Instrumentos Avaliativos (ref. 2025.2)   De 15 a 29  Avaliação de Disciplinas 2º quadrimestre 202 5   De 22 a 26  Solicitação de Aproveitamento de Disciplina como Livre Escolha   De 22 a 26  Solicitação de Equivalência de Disciplina   24 (12h) a 25 (12h)  Reajuste de Matrículas em Disci plinas - 3º quadrimestre de 2025   30 Colação de Grau – exclusivo para concluint es até o 2º quadrimestre de 2025 , que não  dependam dos conceitos de recuperação**    (*) Para solicitar Colação de Grau  neste período, é necessário ter concluído todas as exigências previstas nos  Projetos Pedagógicos dos cursos até a finalização/ o do quadrimestre de 2025.2,', 'incluindo -se a validação de  atividades complementares e extensionistas.']",As datas para a Solicitação de Revisão de Conceito e de Instrumentos Avaliativos são de 15 a 23 de 2025.,As datas para a Solicitação de Revisão de Conceito e de Instrumentos Avaliativos são de 15 a 23 de 2025.,0.9999992625619353,0.0,0.9999999999,1.0
Qual é a data da colação de grau para concluintes até o 2º quadrimestre de 2025?,"['CALENDÁRIO DE PROCEDIMENTOS ADMINISTRATIVO -ACADÊMICOS DA GRADUAÇÃO – 2025    Atualizado em 20.03.2025   4   OUTUBRO   De 01 a 31  Solicitação de Colação de Grau de Novembro – exclusivo para concluintes até 2025.2**   De 06 a 12  Lançamento de conceitos da recuperação (202 5.2)  De 09 a 13  Inscrições para os Cursos de Formação Específica – válida para o 1º quadrimestre de 2026   De 13 a 17  Inscrições para Troca de Curso de Ingresso - válida para o 1º quadrimestre de 2026 (*)  De 13 a 20  Solicitação de Revisão de Conceito e de Instrumentos Avaliativos (ref. 2025.2, pós REC)   26 Fim do prazo para trancamento de matrícula sem justificativa   31 Colação de Grau – exclusivo para concluintes a', 'té o 2º quadrimestre de 2025']",A colação de grau para concluintes até o 2º quadrimestre de 2025 ocorrerá no dia 31 de outubro de 2025.,A colação de grau para concluintes até o 2º quadrimestre de 2025 ocorrerá no dia 31 de outubro de 2025.,0.9496546679180213,0.0,0.9999999999,1.0
Qual é o prazo para solicitar Colação de Grau para os concluintes até o 2º quadrimestre de 2025?,"['31 Colação de Grau – exclusivo para concluintes até o 2º quadrimestre de 2025   (*) A troca de curso será considerada para fins de classificação, somente a partir do período de solicitação de  Matrículas em Disciplinas referente ao quadrimestre 202 6.2  (**) Para solicitar Colação de Grau  neste período, é necessário ter concluído todas as exigências previstas nos  Projetos Pedagógicos dos cursos até a finalização do quadrimestre de 2025 .2, incluindo -se a validação de atividades  complementares e extensionistas .    NOVEMBRO   De 06 a 10  Matrículas para o 1º quadrimestre de 202 6  28 Colação de Grau  – exclusivo para concluintes até o 2º quadrimestre de 202 5*  (*) Para solicitar Colação', 'de Grau neste período, é necessário ter concluído todas as exigências previstas nos']",O prazo para solicitar Colação de Grau para os concluintes até o 2º quadrimestre de 2025 é de 06 a 10 de novembro de 2025.,O prazo para solicitar Colação de Grau para os concluintes até o 2º quadrimestre de 2025 é de 06 a 10 de novembro de 2025.,0.9999999999999996,0.0,0.9999999999,0.0
Qual é o período para solicitar a Colação de Grau de Janeiro/2026?,"['Projetos Pedagógicos dos cursos até a finalização do quadrimestre de 202 5.2, incluindo -se a validação de atividades  complementares e extensionistas.     DEZEMBRO (*)   De 01 a 31  Solicitação de Colação de Grau de Janeiro/2026 – exclusivo para concluintes até 2025.3, que  não dependam dos conceitos de recuperação****   08 a 19/12  Inscrições Cursos de Formação Específica para Egressos de Cursos Interdisciplinares   13 Conc lusão do 3º quadrimestre de 2025   De 15/12/202 5 a  08/01/202 6 Lançamento de conceitos do 3º quadrimestre de 202 5  (*) Não haverá Colação de Grau  em dezembro de 202 5, em função do recesso.   (**) Para solicitar Colação de Grau neste período, é necessário ter conclu', 'ído todas as exigências previstas nos']",O período para solicitar a Colação de Grau de Janeiro/2026 é de 01 a 31 de dezembro de 2025.,O período para solicitar a Colação de Grau de Janeiro/2026 é de 01 a 31 de dezembro de 2025.,0.9999999999999999,1.0,0.9999999999,1.0
Qual é a data limite para a colação de grau dos concluintes até o 3º quadrimestre de 2025?,"['Projetos Pedagógicos dos cursos até a finalização do quadrimestre de 202 5.3, incluindo -se a validação de atividades  complementares e extensionistas.     JANEIRO/202 6  27 (12h) a 28 (23h59)  Ajuste de Matrículas em Disciplinas - 1º quadrimestre de 2026*   30 Colação de Grau – exclusivo para concluintes até o 3º quadrimestre de 202 5, que não  dependam dos conceitos de recuperação** **  (*) Data do ajuste considerando o início de 2016.1 em 09/02   (**) Para solicitar Colação de Grau neste período, é necessário ter concluído todas as exigências previstas nos  Projetos Pedagógicos dos cursos até a finalização do quadrimestre de 202 5.2, incluindo -se a validação de atividades  complementares', 'e extensionistas.']",A data limite para a colação de grau dos concluintes até o 3º quadrimestre de 2025 é 30 de janeiro de 2026.,A data limite para a colação de grau dos concluintes até o 3º quadrimestre de 2025 é 30 de janeiro de 2026.,0.9999999999999998,1.0,0.9999999999,1.0
Quais são as datas do Carnaval em 2025 segundo o calendário da UFABC?,"['M INISTÉRIO DA EDUCAÇÃO  Fundação Universidade Federal do ABC  1  CALENDÁRIO ADMINISTRATIVO DA UFABC 2025  1° de janeiro Quarta-feira Confraternização Universal  Feriado Nacional: Lei Federal nº 10.607/2002 1º de março Sábado Carnaval  (Ponto facultativo/expediente suspenso) - Calendário Acadêmico** 3 de março Segunda-feira Carnaval  (Ponto facultativo/expediente suspenso*)  4 de março Terça-Feira Carnaval  (Ponto facultativo/expediente suspenso*)  5 de março Quarta-feira Cinzas  (Ponto Facultativo/Expediente Suspenso*)  7 de abril Segunda-feira (Ponto Facultativo/Expediente Suspenso) - Calendário Acadêmico** (Somente no campus Santo André)  8 de abril Terça-feira Feriado Municipal de Santo', 'André  Feriado Municipal nº 2.634/1967 (Santo André)']","As datas do Carnaval em 2025 segundo o calendário da UFABC são 1º de março (sábado), 3 de março (segunda-feira), 4 de março (terça-feira) e 5 de março (quarta-feira de cinzas).","As datas do Carnaval em 2025 segundo o calendário da UFABC são 1º de março (sábado), 3 de março (segunda-feira), 4 de março (terça-feira) e 5 de março (quarta-feira de cinzas).",0.9131305402948393,1.0,0.9999999999,1.0
Qual é a data do feriado da Paixão de Cristo em 2024 no campus Santo André?,"['Feriado Municipal nº 2.634/1967 (Santo André) (Somente no campus Santo André, nos termos do Art. 2º da  Portaria MGI nº 9.783/2024)  18 de abril Sexta-feira Paixão de Cristo  Feriado Nacional: Lei Federal nº. 9.093/1995; Feriado religioso  disposto nas Leis Municipais nº 2.634/1967 (Santo André) e nº  1.493/1967 (São Bernardo do Campo) 19 de abril Sábado Sábado de Aleluia  (Ponto Facultativo/Expediente Suspenso) - Calendário Acadêmico** 21 de abril Segunda-feira Tiradentes  Feriado Nacional: Lei Federal nº 10.607/2002 1º de maio Quinta-feira Dia Mundial do Trabalho  Feriado Nacional: Lei Federal nº 10.607/2002 2 de maio Sexta-feira (Ponto Facultativo/Expediente Suspenso) - Calendário Acadêmi', 'co** 3 de maio Sábado (Ponto Facultativo/Expediente Suspenso) - Calendário Acadêmico**']","A data do feriado da Paixão de Cristo em 2024 no campus Santo André é 18 de abril, uma sexta-feira.","A data do feriado da Paixão de Cristo em 2024 no campus Santo André é 18 de abril, uma sexta-feira.",0.9999999999999997,1.0,0.9999999999,1.0
Quais são as datas em que o expediente está suspenso em junho?,['3 de maio Sábado (Ponto Facultativo/Expediente Suspenso) - Calendário Acadêmico** 19 de junho Quinta-feira Corpus Christi  Feriado Nacional: Lei Federal nº. 9.093/1995; Feriado religioso  disposto nas Leis Municipais nº 2.634/1967 (Santo André) e nº  1.493/1967 (São Bernardo do Campo) 20 de junho Sexta-feira (Ponto facultativo/expediente suspenso*)  21 de junho Sábado (Ponto Facultativo/Expediente Suspenso) - Calendário Acadêmico** ANEXO - PORTARIA Nº 4611 / 2025 - REIT (11.01) Boletim de Serviço nº 1409  03 de janeiro de 2025'],"Em junho, o expediente está suspenso nos dias 20 e 21.","Em junho, o expediente está suspenso nos dias 20 e 21.",0.9775792572635239,1.0,0.9999999999,1.0
Quais são os feriados mencionados no texto que ocorrem em um domingo?,"['2   9 de julho Quarta-feira Data Magna do Estado de São Paulo (Revolução Constitucionalista  de 1932)  Feriado Estadual: Lei Federal nº. 9.093/1995; Lei Estadual nº  9.497/1997  20 de agosto Quarta-feira Feriado Municipal de São Bernardo do Campo  Feriado Municipal nº 1.493/1967   (Somente no campus São Bernardo do Campo , nos termos do Art.  2º da Portaria MGI nº 9.783/2024)   7 de setembro Domingo Independência do Brasil   Feriado Nacional: Lei Federal nº 10.607/2002 12 de outubro Domingo Nossa Senhora Aparecida (Padroeira do Brasil) Feriado Nacional: Lei Federal nº 6.802/1980   27 de outubro Segunda-feira (Ponto Facultativo/Expediente Suspenso) - Calendário Acadêmico** 28 de outubro Terça', '-feira Comemor ação do Dia do Servidor Público Art. 236 da Lei nº 8.112/1990']",Os feriados mencionados no texto que ocorrem em um domingo são: 7 de setembro (Independência do Brasil) e 12 de outubro (Nossa Senhora Aparecida).,Os feriados mencionados no texto que ocorrem em um domingo são: 7 de setembro (Independência do Brasil) e 12 de outubro (Nossa Senhora Aparecida).,0.9752120193607811,0.5,0.9999999999,1.0
Quais são as datas mencionadas no texto que correspondem a feriados nacionais?,"['28 de outubro Terça-feira Comemor ação do Dia do Servidor Público Art. 236 da Lei nº 8.112/1990  (Ponto Facultativo/Expediente Suspenso) - Calendário Acadêmico** 2 de novembro Domingo Finados  Feriado Nacional: Lei Federal nº 10.607/2002 15 de novembro Sábado Proclamação da República   Feriado Nacional: Lei Federal nº 10.607/2002 20 de novembro Quinta-feira Dia Nacional de Zumbi e da Consciência Negra Feriado Nacional: Lei Federal nº 12.519/2011; Feriado Municipal: Leis  Municipais nº 8.57 8/2003 (Santo André) e nº 5.947/2009 (São  Bernardo do Campo)  21 de novembro Sexta-feira (Ponto Facultativo/Expediente Suspenso) - Calendário Acadêmico** 22 de novembro Sábado (Ponto Facultativo/Expedient', 'e Suspenso) - Calendário Acadêmico**']","As datas mencionadas no texto que correspondem a feriados nacionais são 2 de novembro (Finados), 15 de novembro (Proclamação da República) e 20 de novembro (Dia Nacional de Zumbi e da Consciência Negra).","As datas mencionadas no texto que correspondem a feriados nacionais são 2 de novembro (Finados), 15 de novembro (Proclamação da República) e 20 de novembro (Dia Nacional de Zumbi e da Consciência Negra).",0.942488350983312,1.0,0.9999999999,1.0
Quais datas são consideradas ponto facultativo ou expediente suspenso no calendário acadêmico?,"['22 de novembro Sábado (Ponto Facultativo/Expediente Suspenso) - Calendário Acadêmico** 24 de dezembro Quarta-feira (Ponto Facultativo/Expediente Suspenso) - Calendário Acadêmico** 25 de dezembro Quinta-feira Natal  Feriado Nacional: Lei Federal nº 10.607/2002 31 de dezembro Quarta-feira (Ponto Facultativo/Expediente Suspenso) - Calendário Acadêmico**   * Os dias considerados como ponto facultativo/expediente suspenso  não precisarão ser compensados. - calendário  Ato  Decisório do ConsEPE  e não precisarão ser compensados.   A Superintendência de Gestão de Pessoas  SUGEPE informará , oportunamente, os dias a serem considerados . Esses dias deverão ser compensados em forma e o período estabel', 'ecidos pelo Órgão Central do Sistema de Pessoal Civil da Administração Federal  - SIPEC.']","As datas consideradas ponto facultativo ou expediente suspenso no calendário acadêmico são 22 de novembro (sábado), 24 de dezembro (quarta-feira) e 31 de dezembro (quarta-feira).","As datas consideradas ponto facultativo ou expediente suspenso no calendário acadêmico são 22 de novembro (sábado), 24 de dezembro (quarta-feira) e 31 de dezembro (quarta-feira).",0.994880381356546,1.0,0.9999999999,1.0
Qual é o órgão central do Sistema de Pessoal Civil da Administração Federal?,"['Órgão Central do Sistema de Pessoal Civil da Administração Federal  - SIPEC.  Caberá às pessoas dirigentes  a preservação e o funcionamento dos serviços essenciais relativos às respectivas áreas  de compet ência, de acordo com o disposto no Art. 4º Portaria MGI nº 9.783, de 27 de dezembro de 2024 .   ANEXO - PORTARIA Nº 4611 / 2025 - REIT (11.01) Boletim de Serviço nº 1409  03 de janeiro de 2025']",O órgão central do Sistema de Pessoal Civil da Administração Federal é o SIPEC.,O órgão central do Sistema de Pessoal Civil da Administração Federal é o SIPEC.,0.9999999999999998,1.0,0.9999999999,1.0
Quais foram as principais mudanças na Resolução ConsEPE nº 260?,"['1.   Principais   novidades   A   Resolução   ConsEPE   nº   260   consolidou   normas   anteriormente   dispersas   em   três   resoluções   ConsEPE   (131,   202   e   219)   e   duas   portarias   Prograd   (números   32   e   33/2016).   As   principais   alterações   são:   ●   A   fórmula   para   cálculo   do   limite   de   créditos   para   a   matrícula   passou   de   C=   16+5CR   e   passou   para   C=20+2CA   (questão   4).   ●   Extinguiu-se   o   limite   de   disciplinas   que   podem   ser   canceladas   na   primeira   semana   (questão   9).   ●   Foram   uniformizados   os   critérios   de   alocação   de   vagas   na   primeira   fase   da   matrícula   considerando,', 'na   seguinte   ordem,   curso,   turno,   CP   e   CA   (questão   5).   ●   Foi   estabelecida   a']","As principais mudanças na Resolução ConsEPE nº 260 foram: a fórmula para cálculo do limite de créditos para a matrícula passou de C=16+5CR para C=20+2CA, extinguiu-se o limite de disciplinas que podem ser canceladas na primeira semana, e foram uniformizados os critérios de alocação de vagas na primeira fase da matrícula considerando curso, turno, CP e CA.","As principais mudanças na Resolução ConsEPE nº 260 foram: a fórmula para cálculo do limite de créditos para a matrícula passou de C=16+5CR para C=20+2CA, extinguiu-se o limite de disciplinas que podem ser canceladas na primeira semana, e foram uniformizados os critérios de alocação de vagas na primeira fase da matrícula considerando curso, turno, CP e CA.",0.9999968123270576,1.0,0.9999999999,1.0
Qual é a reserva percentual de vagas em disciplinas de CFE para discentes sem vínculo com o curso?,"['seguinte   ordem,   curso,   turno,   CP   e   CA   (questão   5).   ●   Foi   estabelecida   a   reserva   de   20%   das   vagas   em   disciplinas   de   CFE   para   discentes   sem   vínculo   com   o   curso   (questão   5)   ●   Foram   incluídas   as   mães   de   crianças   de   até   12   anos   entre   as   prioridades   para   a   matrícula   e   como   justificativa   para   troca   de   turno   de   disciplina   (questões   13   e   15).   ●   Foram   normalizados   procedimentos   que   já   foram   aplicados   em   anos   anteriores   para   matrículas   de   ingressantes   regulares   e   por   transferência   externa   (questão   12)     2.   Qual   a   diferença   entre', 'matrícula,   ajuste   e   reajuste   de   matrícula?   (Artigos   3º   a   5º   da   Resolução']",A reserva percentual de vagas em disciplinas de CFE para discentes sem vínculo com o curso é de 20%.,A reserva percentual de vagas em disciplinas de CFE para discentes sem vínculo com o curso é de 20%.,0.9999999999999994,1.0,0.9999999999,1.0
Quais são as três fases da matrícula em disciplinas na UFABC?,"['matrícula,   ajuste   e   reajuste   de   matrícula?   (Artigos   3º   a   5º   da   Resolução   ConsEPE   nº   260 )   Matrícula,   ajuste   e   reajuste   são   as   três   fases   da   matrícula   em   disciplinas   na   UFABC.     A   matrícula   é   a   primeira   fase   e   nela   são   disponibilizadas   todas   as   vagas   previstas   no   planejamento   de   oferta.   A   alocação   de   vagas   durante   a   matrícula   obedece   a   critérios   como   curso   ao   qual   a   pessoa   é   vinculada,   turno,   CP   ou   CA   (ver   detalhes   na   questão   5 ).     O   ajuste   é   a   segunda   fase   e   tem   oferta   de   vagas   remanescentes   do   processo   de   matrícula', ',   além   de   vagas   resultantes   de   novas   turmas   ou   expansão   de   vagas.   Durante']","As três fases da matrícula em disciplinas na UFABC são matrícula, ajuste e reajuste.","As três fases da matrícula em disciplinas na UFABC são matrícula, ajuste e reajuste.",0.9746971941466539,0.0,0.9999999999,1.0
Quais tipos de vagas são disponibilizadas no reajuste de matrícula?,"['além   de   vagas   resultantes   de   novas   turmas   ou   expansão   de   vagas.   Durante   o   ajuste   pode-se   excluir   disciplinas   em   que   havia   matrícula   anterior   e,   com   isso,   as   novas   vagas   abertas   são   também   disponibilizadas   para   matrícula.   As   vagas   são   alocadas   por   ordem   de   inscrição   (ver   detalhes   e   orientações   na   questão   6 ).   O   reajuste   de   matrícula   é   a   terceira   fase   e   ocorre   após   o   início   das   aulas   e   o   término   do   período   de   cancelamento   de   disciplinas   e   nessa   fase   são   disponibilizadas   as   vagas   remanescentes   das   fases   anteriores   e   também   as', 'vagas   que   foram   canceladas   durante   a   primeira   semana   de   aulas.   As   vagas']","No reajuste de matrícula, são disponibilizadas as vagas remanescentes das fases anteriores e também as vagas que foram canceladas durante a primeira semana de aulas.","No reajuste de matrícula, são disponibilizadas as vagas remanescentes das fases anteriores e também as vagas que foram canceladas durante a primeira semana de aulas.",0.967131710882977,1.0,0.9999999999,1.0
Quais vagas foram canceladas durante a primeira semana de aulas?,['as   vagas   que   foram   canceladas   durante   a   primeira   semana   de   aulas.   As   vagas   são   alocadas   por   ordem   de   inscrição   (ver   detalhes   e   orientações   na   questão   7 ).       3.   Quais   são   as   datas   da   matrícula   em   disciplinas?'],As vagas que foram canceladas durante a primeira semana de aulas são aquelas que foram alocadas por ordem de inscrição.,As vagas que foram canceladas durante a primeira semana de aulas são aquelas que foram alocadas por ordem de inscrição.,0.9999999999999994,0.0,0.9999999999,1.0
Qual é a fórmula para calcular o número máximo de créditos para matrícula?,"['As   datas   estão   disponíveis   para   consulta   no   calendário   de   procedimentos   administrativo-acadêmicos ,   publicado   em   calendários .       4.   Em   quantas   disciplinas   posso   me   matricular?   Há   um   limite   de   créditos?   (Artigo   8º   da   Resolução   ConsEPE   nº   260 )   O   número   máximo   de   créditos   em   que   se   pode   solicitar   matrícula   é   dado   pela   fórmula   C=   20   +2CA.   O   número   de   créditos   de   uma   disciplina   é   a   soma   do   número   de   horas   semanais   de   aula   teórica   (T)   e   o   número   de   créditos   de   aula   prática   (P).   Não   se   incluem   no   valor   de   ""C""   os   créditos   c', 'orrespondentes   aos   componentes   curriculares   integralizadores   tais   como   Estágio']",A fórmula para calcular o número máximo de créditos para matrícula é C = 20 + 2CA.,A fórmula para calcular o número máximo de créditos para matrícula é C = 20 + 2CA.,0.9999999999999998,1.0,0.9999999999,1.0
Quais são os critérios para alocação de vaga nas disciplinas durante a primeira fase da matrícula?,"['correspondentes   aos   componentes   curriculares   integralizadores   tais   como   Estágio   Curricular,   Trabalho   de   Conclusão   de   Curso   (TCC),   Trabalho   de   Graduação   (TG)   ou   Monografias.       5.   Quais   os   critérios   para   alocação   de   vaga   nas   disciplinas   durante   a   primeira   fase   da   matrícula?   (Artigos   9º   e   12   da   Resolução   ConsEPE   nº   260 )   Para   todas   as   disciplinas   dos   ofertadas   pelo   cursos   interdisciplinares   de   ingresso   (BC&T,   BC&H,   LCH   e   LCNE)   os   critérios   são,   em   ordem   decrescente:   I   -   Curso   interdisciplinar   de   ingresso   para   o   qual   a   disciplina   seja   o', 'brigatória;   II   -   Mesmo   turno   de   matrícula   do(a)   discente   e   oferta   da']","Os critérios para alocação de vaga nas disciplinas durante a primeira fase da matrícula, conforme os Artigos 9º e 12 da Resolução ConsEPE nº 260, são, em ordem decrescente: I - Curso interdisciplinar de ingresso para o qual a disciplina seja obrigatória; II - Mesmo turno de matrícula do(a) discente e oferta da disciplina.","Os critérios para alocação de vaga nas disciplinas durante a primeira fase da matrícula, conforme os Artigos 9º e 12 da Resolução ConsEPE nº 260, são, em ordem decrescente: I - Curso interdisciplinar de ingresso para o qual a disciplina seja obrigatória; II - Mesmo turno de matrícula do(a) discente e oferta da disciplina.",0.999997212410798,1.0,0.9999999999,1.0
Quais são os critérios em ordem decrescente para as disciplinas ofertadas pelos cursos de formação específica?,"['obrigatória;   II   -   Mesmo   turno   de   matrícula   do(a)   discente   e   oferta   da   disciplina;   III   -   Coeficiente   de   Progressão   (CP),   em   ordem   decrescente;   IV   -   Coeficiente   de   Aproveitamento   (CA),   em   ordem   decrescente.       Para   as   disciplinas   ofertadas   pelos   cursos   de   formação   específica,   os   critérios   são,   em   ordem   decrescente:   I   -   Vínculo   (matrícula   ou   reserva   de   vaga)   com   curso   de   formação   específica   para   o   qual   a   disciplina   é   obrigatória   ou   de   opção   limitada;   II   -   Mesmo   turno   de   matrícula   do(a)   discente   e   oferta   da   disciplina;   III   -   Coef', 'iciente   de   Progressão   (CP),   em   ordem   decrescente;']","Os critérios em ordem decrescente para as disciplinas ofertadas pelos cursos de formação específica são: I - Vínculo (matrícula ou reserva de vaga) com curso de formação específica para o qual a disciplina é obrigatória ou de opção limitada; II - Mesmo turno de matrícula do(a) discente e oferta da disciplina; III - Coeficiente de Progressão (CP), em ordem decrescente.","Os critérios em ordem decrescente para as disciplinas ofertadas pelos cursos de formação específica são: I - Vínculo (matrícula ou reserva de vaga) com curso de formação específica para o qual a disciplina é obrigatória ou de opção limitada; II - Mesmo turno de matrícula do(a) discente e oferta da disciplina; III - Coeficiente de Progressão (CP), em ordem decrescente.",0.9141821572996485,1.0,0.9999999999,1.0
Qual é a porcentagem de vagas reservadas para discentes sem vínculo com o curso nas turmas de formação específica?,"['IV   -   Coeficiente   de   Aproveitamento   (CA),   em   ordem   decrescente.       Em   todas   as   turmas   ofertadas   pelos   cursos   de   formação   específica   haverá   20%   das   vagas   reservadas   para   discentes   que   não   têm   vínculo   com   o   curso.       6.   O   que   eu   preciso   saber   para   o   ajuste   de   matrículas?   (Artigos   18   a   20   da   Resolução   ConsEPE   nº   260 )   O   ajuste   de   matrícula   ocorre   durante   o   período   do   recesso   acadêmico   (consulte   as   datas   no   calendário   de   procedimentos   administrativos-acadêmicos   vigente)   e   é   interessante   caso   seja   preciso   alterar   a   matrícula   feita   n', 'o   período   regular   -   por   não   ter   conseguido   vaga   em   alguma   disciplina   ou']",20% das vagas nas turmas de formação específica são reservadas para discentes que não têm vínculo com o curso.,20% das vagas nas turmas de formação específica são reservadas para discentes que não têm vínculo com o curso.,0.9955263652043114,1.0,0.9999999999,1.0
Quais ações são permitidas no período de ajuste das disciplinas?,"['no   período   regular   -   por   não   ter   conseguido   vaga   em   alguma   disciplina   ou   por   se   fazer   necessário   alterar   o   planejamento   acadêmico,   por   exemplo.   No   ajuste,   as   vagas   são   alocadas   por   ordem   de   solicitação.   Nessa   fase,   além   de   incluir   disciplinas,   é   possível   excluí-las   e   as   vagas   liberadas   são   disponibilizadas   no   sistema   de   matrícula.   Assim,   novas   vagas   podem   surgir   ao   longo   do   período   de   ajuste.   No   entanto,   disciplinas   de   alta   demanda,   ou   seja,   que   tiveram   um   número   de   solicitações   superior   a   150%   do   número   de   vagas   ofertadas,', 'não   podem   ser   excluídas   no   período   do   ajuste.   O   limite   de   créditos   para']","No período de ajuste, é possível incluir disciplinas, excluir disciplinas que não sejam de alta demanda e as vagas liberadas são disponibilizadas no sistema de matrícula.","No período de ajuste, é possível incluir disciplinas, excluir disciplinas que não sejam de alta demanda e as vagas liberadas são disponibilizadas no sistema de matrícula.",0.7069184428927606,1.0,0.9999999999,1.0
Quando ocorre o reajuste de matrículas?,"['não   podem   ser   excluídas   no   período   do   ajuste.   O   limite   de   créditos   para   matrícula   é   o   mesmo   da   matrícula   regular   C=   20   +   2CA   (ver   questão   4 ).       7.   O   que   eu   preciso   saber   para   o   reajuste   de   matrículas?   (Artigos   18   e   21   da   Resolução   ConsEPE   nº   260 )   O   reajuste   ocorre   na   segunda   semana   de   aulas,   após   encerrar   o   período   de   cancelamento   de   disciplinas.   Recomenda-se   que   a   escolha   de   disciplinas   no   reajuste   seja   criteriosa   e   pontual,   ou   seja,   que   se   busque   vaga   naquelas   disciplinas   que   são   mais   essenciais   para   a   formação', '.   Ademais,   é   preciso   muita   atenção   porque   já   se   terão   passado   duas']","O reajuste de matrículas ocorre na segunda semana de aulas, após encerrar o período de cancelamento de disciplinas.","O reajuste de matrículas ocorre na segunda semana de aulas, após encerrar o período de cancelamento de disciplinas.",1.0000000000000002,1.0,0.9999999999,1.0
Qual é a recomendação para quem pega uma disciplina no reajuste?,"['formação.   Ademais,   é   preciso   muita   atenção   porque   já   se   terão   passado   duas   semanas   de   aula   e   pode   ser   necessário   estudo   extra   para   acompanhar   as   aulas.   Ao   pegar   uma   disciplina   no   reajuste,   recomenda-se   conversar   com   a/o   docente   responsável   na   primeira   aula   após   conseguir   a   matrícula   para   receber   orientações.   No   reajuste   as   vagas   são   alocadas   por   ordem   de   solicitação.']",Recomenda-se conversar com a/o docente responsável na primeira aula após conseguir a matrícula para receber orientações.,Recomenda-se conversar com a/o docente responsável na primeira aula após conseguir a matrícula para receber orientações.,0.45904307803099526,1.0,0.9999999999,1.0
É possível excluir disciplinas nessa fase?,"['Nessa   fase   não   é   possível   excluir   disciplinas,   sendo   possível   apenas   a   inclusão   até   o   limite   do   número   de   créditos   C=   20   +   2CA   (ver   questão   4 ).       8.   Perdi   a   matrícula,   e   agora?   (Artigos   3º   a   5º   da   Resolução   ConsEPE   nº   260 )   Caso   não   a   matrícula   não   tenha   sido   efetuada   no   período   regular,   pode-se   pegar   disciplinas   nos   períodos   de   ajuste   ou   de   reajuste   pelo   sistema   de   matrículas.   No   entanto,   se   após   essas   fases   a   pessoa   ainda   não   tiver   matrícula   em   disciplinas,   não   será   possível   efetuar   a   matrícula.   Nesse   caso   deve-se', 'considerar   a   possibilidade   de   trancamento   de   matrícula   (ver   questões   10   e']","Nessa fase não é possível excluir disciplinas, sendo possível apenas a inclusão até o limite do número de créditos.","Nessa fase não é possível excluir disciplinas, sendo possível apenas a inclusão até o limite do número de créditos.",0.0,1.0,0.9999999999,1.0
Como posso cancelar uma disciplina?,"['considerar   a   possibilidade   de   trancamento   de   matrícula   (ver   questões   10   e   11 ).       9.   Como   faço   para   cancelar   uma   disciplina?   (Artigos   22   e   23   da   Resolução   ConsEPE   nº   260 )   O   planejamento   deve   ser   realizado   a   partir   do   planejamento   acadêmico   e   considerando   a   demanda   de   cada   disciplina   e   as   condições   de   cada   discente.   Essa   avaliação   deve   ser   feita   na   primeira   semana,   antes   do   fim   do   prazo   de   cancelamento.   O   cancelamento   de   disciplinas   é   realizado   pelo   SIGAA   e   não   pode   ser   cancelada   disciplina   que   já   tenha   sido   cancelada   ante', 'riormente   ou   que   já   tenha   sido   reprovada   por   frequência.   Pode-se   cancelar']","Para cancelar uma disciplina, você deve realizar o planejamento a partir do planejamento acadêmico e considerar a demanda de cada disciplina e as condições de cada discente, fazer essa avaliação na primeira semana, antes do fim do prazo de cancelamento, e realizar o cancelamento pelo SIGAA, lembrando que não é possível cancelar uma disciplina que já tenha sido cancelada anteriormente ou que já tenha sido reprovada por frequência.","Para cancelar uma disciplina, você deve realizar o planejamento a partir do planejamento acadêmico e considerar a demanda de cada disciplina e as condições de cada discente, fazer essa avaliação na primeira semana, antes do fim do prazo de cancelamento, e realizar o cancelamento pelo SIGAA, lembrando que não é possível cancelar uma disciplina que já tenha sido cancelada anteriormente ou que já tenha sido reprovada por frequência.",0.9149883207159406,1.0,0.9999999999,1.0
Qual é a diferença entre cancelar a matrícula e trancar o quadrimestre na UFABC?,"['anteriormente   ou   que   já   tenha   sido   reprovada   por   frequência.   Pode-se   cancelar   qualquer   número   de   disciplinas.   No   entanto,   se   houver   cancelamento   de   todas   as   disciplinas,   o   quadrimestre   será   contabilizado   no   histórico   como   um   quadrimestre   cursado   sem   matrícula   em   disciplinas.   Nesse   caso,   veja   a   resposta   à   questão   11   e   considere   a   possibilidade   de   trancar   o   quadrimestre.       10.   Cancelar   a   matrícula   é   a   mesma   coisa   que   trancar?   Não.   Na   UFABC   cancelamento   e   trancamento   são   procedimentos   muito   distintos.   Cancelamento   refere-se   a   disciplinas   e', 'é   realizado   apenas   na   primeira   semana   de   aulas.   No   cancelamento,   deve-se']","Na UFABC, cancelar a matrícula refere-se ao cancelamento de disciplinas e é realizado apenas na primeira semana de aulas, enquanto trancar o quadrimestre é um procedimento distinto.","Na UFABC, cancelar a matrícula refere-se ao cancelamento de disciplinas e é realizado apenas na primeira semana de aulas, enquanto trancar o quadrimestre é um procedimento distinto.",1.0,0.6666666666666666,0.9999999999,1.0
Quando o trancamento do curso pode ser realizado?,"['e   é   realizado   apenas   na   primeira   semana   de   aulas.   No   cancelamento,   deve-se   escolher   quais   disciplinas   cancelar   e   as   demais   serão   cursadas.   Trancamento   diz   respeito   ao   curso   e   pode   ser   realizado   sem   justificativa   até   a   sexta   semana   de   aulas.   No   trancamento   nenhuma   disciplina   será   cursada   e   o   quadrimestre   não   será   contabilizado   no   prazo   para   integralização   do   curso.']",O trancamento do curso pode ser realizado sem justificativa até a sexta semana de aulas.,O trancamento do curso pode ser realizado sem justificativa até a sexta semana de aulas.,0.8572162806927226,1.0,0.9999999999,1.0
Qual é a consequência de ter dois quadrimestres consecutivos sem matrícula e sem trancamento?,"['11.   Qual   a   diferença   entre   quadrimestre   trancado   e   quadrimestre   sem   matrícula   e   sem   trancamento?   Em   ambos   os   casos   não   há   matrícula   em   disciplinas   durante   o   quadrimestre.   No   entanto,   quando   se   efetua   o   trancamento,   o   quadrimestre   é   desconsiderado   no   cálculo   de   prazo   para   integralização   do   curso.   Se   o   trancamento   não   é   efetuado,   o   quadrimestre   sem   matrícula   em   disciplinas   será   contabilizado.   Ademais,   dois   quadrimestres   consecutivos   sem   matrícula   em   disciplinas   e   sem   trancamento   acarretam   desligamento   do   curso   por   abandono.   Para   mais   inform', 'ações   sobre   trancamento,   consulte   a   Resolução   ConsEPE   nº   243 .       12.   Há']",A consequência de ter dois quadrimestres consecutivos sem matrícula e sem trancamento é o desligamento do curso por abandono.,A consequência de ter dois quadrimestres consecutivos sem matrícula e sem trancamento é o desligamento do curso por abandono.,0.9999996410816935,1.0,0.9999999999,1.0
Quais são os critérios especiais para ingressantes nas primeiras matrículas?,"['sobre   trancamento,   consulte   a   Resolução   ConsEPE   nº   243 .       12.   Há   critérios   especiais   para   ingressantes   nas   primeiras   matrículas?   (Artigos   1º   e   15   da   Resolução   ConsEPE   nº   260 )   Sim,   mas   os   critérios   são   diferentes   para   ingressantes   regulares   e   para   ingressantes   via   transferência   externa,   conforme   a   tabela   a   seguir:       Ingressantes   Regulares   Transferência   Externa   Primeiro   quadrimestre   (após   o   ingresso)   Matrícula   feita   automaticamente   pela   UFABC   nas   disciplinas   obrigatórias   sugeridas   para   o   primeiro   quadrimestre   do   curso.   Na   fase   da   matrícula   re', 'gular,   têm   prioridade   na   classificação   em   turmas   de   disciplinas   obrigatórias']","Os critérios especiais para ingressantes nas primeiras matrículas são que, para ingressantes regulares, a matrícula é feita automaticamente pela UFABC nas disciplinas obrigatórias sugeridas para o primeiro quadrimestre do curso e, na fase da matrícula regular, têm prioridade na classificação em turmas de disciplinas obrigatórias.","Os critérios especiais para ingressantes nas primeiras matrículas são que, para ingressantes regulares, a matrícula é feita automaticamente pela UFABC nas disciplinas obrigatórias sugeridas para o primeiro quadrimestre do curso e, na fase da matrícula regular, têm prioridade na classificação em turmas de disciplinas obrigatórias.",0.8608911607512616,0.75,0.99999999995,1.0
Quem tem prioridade na classificação em turmas de disciplinas obrigatórias?,"['regular,   têm   prioridade   na   classificação   em   turmas   de   disciplinas   obrigatórias   do   seu   curso   e   turno.     Caso   não   seja   possível   a   matrícula   no   período   regular,   têm   prioridade   no   acesso   ao   sistema   no   ajuste   de   matrículas.']",Os alunos que estão no período regular têm prioridade na classificação em turmas de disciplinas obrigatórias do seu curso e turno.,Os alunos que estão no período regular têm prioridade na classificação em turmas de disciplinas obrigatórias do seu curso e turno.,0.9999999999999998,1.0,0.9999999999,1.0
Qual é o critério de classificação para a matrícula em turmas com excesso de solicitações?,"['Segundo   quadrimestre   (após   o   ingresso)   Devem   solicitar   matrícula   em   disciplinas   no   período   regular   pelo   sistema   de   matrículas.   Há   reserva   de   vaga   nas   disciplinas   obrigatórias   previstas   para   o   segundo   quadrimestre   do   curso   em   que   está   matriculado,   considerando   o   mesmo   turno   de   ingresso,   sendo   que   o   preenchimento   das   vagas   reservadas   por   turma   é   efetuado   por   ordem   de   chegada.   Na   fase   da   matrícula   regular,   têm   prioridade   na   classificação   em   turmas   de   disciplinas   obrigatórias   do   seu   curso   e   turno.   Se   houver   excesso   de   solicitações   de   ma', 'trículas   na   turma,   a   classificação   será   pela   nota   do   ENEM.   Ajuste   e   reajuste']",O critério de classificação para a matrícula em turmas com excesso de solicitações é pela nota do ENEM.,O critério de classificação para a matrícula em turmas com excesso de solicitações é pela nota do ENEM.,0.9999999999999998,1.0,0.49999999995,1.0
Existem políticas especiais para grupos na matrícula?,"['na   turma,   a   classificação   será   pela   nota   do   ENEM.   Ajuste   e   reajuste   Seguem   as   mesmas   regras   do   restante   do   corpo   discente   Seguem   as   mesmas   regras   do   restante   do   corpo   discente,   com   exceção   do   primeiro   quadrimestre   se   não   tiverem   acesso   à   matrícula   no   período   regular.   Nesse   caso,   terão   prioridade   de   acesso   ao   sistema   de   matrícula   no   período   de   ajuste.       13.   Há   políticas   especiais   para   outros   grupos   na   matrícula?   (Artigos   13   e   14   da   Resolução   ConsEPE   nº   260 )   Sim.   Terão   vaga   garantida   em   quaisquer   disciplinas   em   que   solicita', 'rem   matrícula:   I   -   Discentes   cadastrados(as)   como   PCD   (pessoas   com']","Sim, existem políticas especiais para grupos na matrícula, conforme os Artigos 13 e 14 da Resolução ConsEPE nº 260, garantindo vaga em quaisquer disciplinas em que solicitarem matrícula para discentes cadastrados(as) como PCD (pessoas com deficiência).","Sim, existem políticas especiais para grupos na matrícula, conforme os Artigos 13 e 14 da Resolução ConsEPE nº 260, garantindo vaga em quaisquer disciplinas em que solicitarem matrícula para discentes cadastrados(as) como PCD (pessoas com deficiência).",0.8556830856962894,1.0,0.9999999999,1.0
Quais grupos de discentes têm prioridade na matrícula?,"['solicitarem   matrícula:   I   -   Discentes   cadastrados(as)   como   PCD   (pessoas   com   deficiência)   no   Núcleo   de   Acessibilidade;   II   -   Discentes   de   mobilidade   acadêmica;   III   -   Discentes   cadastradas   como   mães   de   crianças   com   até   12   (doze)   anos   de   idade.   Além   desses   grupos,   discentes   acompanhados   pela   DEAT   têm   prioridade   nas   disciplinas   indicadas   pela   equipe   de   orientação   pedagógica.']","Os grupos de discentes que têm prioridade na matrícula são: I - Discentes cadastrados(as) como PCD (pessoas com deficiência) no Núcleo de Acessibilidade; II - Discentes de mobilidade acadêmica; III - Discentes cadastradas como mães de crianças com até 12 (doze) anos de idade; além disso, discentes acompanhados pela DEAT têm prioridade nas disciplinas indicadas pela equipe de orientação pedagógica.","Os grupos de discentes que têm prioridade na matrícula são: I - Discentes cadastrados(as) como PCD (pessoas com deficiência) no Núcleo de Acessibilidade; II - Discentes de mobilidade acadêmica; III - Discentes cadastradas como mães de crianças com até 12 (doze) anos de idade; além disso, discentes acompanhados pela DEAT têm prioridade nas disciplinas indicadas pela equipe de orientação pedagógica.",0.9999999999999996,1.0,0.9999999999,1.0
Por que fui alocado em uma turma diferente da que me matriculei?,"['14.   Me   matriculei   em   uma   turma,   mas   fui   alocado   em   outra.   O   que   aconteceu?   (Artigo   17   da   Resolução   ConsEPE   nº   260 )   Pode   haver   remanejamento   de   matrícula   para   outras   turmas   no   mesmo   horário   e   campus   se   houver   excesso   de   solicitações   para   uma   turma.   Nesse   caso,   matrículas   indeferidas   para   uma   turma   podem   ser   alocadas   em   outra   até   o   limite   do   número   de   vagas   (ver   art.   17   da   Resolução   ConsEPE   nº   260 ).       15.   Posso   trocar   o   turno   de   uma   disciplina   em   que   tenho   matrícula?   (Artigo   24   da   Resolução   ConsEPE   nº   260 )   Em   algu', 'ns   casos   é   possível   solicitar   a   troca   de   turno   da   disciplina,   mas   o']","Você foi alocado em uma turma diferente da que se matriculou porque pode haver remanejamento de matrícula para outras turmas no mesmo horário e campus se houver excesso de solicitações para uma turma, conforme o artigo 17 da Resolução ConsEPE nº 260.","Você foi alocado em uma turma diferente da que se matriculou porque pode haver remanejamento de matrícula para outras turmas no mesmo horário e campus se houver excesso de solicitações para uma turma, conforme o artigo 17 da Resolução ConsEPE nº 260.",0.9352877576046591,1.0,0.9999999999,1.0
Quem pode solicitar a troca de turno da disciplina?,"['alguns   casos   é   possível   solicitar   a   troca   de   turno   da   disciplina,   mas   o   deferimento   depende   da   existência   de   vagas   no   turno   solicitado.   Caso   não   seja   possível   efetuar   a   troca   devido   à   falta   de   vagas,   a   matrícula   na   disciplina   será   excluída.   Podem   solicitar   a   troca   de   turno   discentes   cuja   disponibilidade   de   horário   foi   alterada   devido   a   vínculo   empregatício   ou   estágio,   no   entanto,   é   necessário   comprovar   que   a   alteração   se   deu   após   a   solicitação   de   matrícula   na   disciplina.   Também   podem   solicitar   a   troca   de   turno   as   discentes   m', 'ães   de   crianças   com   até   12   anos   de   idade.   A   solicitação   de   troca   de']","Podem solicitar a troca de turno da disciplina discentes cuja disponibilidade de horário foi alterada devido a vínculo empregatício ou estágio, desde que comprovem que a alteração se deu após a solicitação de matrícula na disciplina, e também discentes mães de crianças com até 12 anos de idade.","Podem solicitar a troca de turno da disciplina discentes cuja disponibilidade de horário foi alterada devido a vínculo empregatício ou estágio, desde que comprovem que a alteração se deu após a solicitação de matrícula na disciplina, e também discentes mães de crianças com até 12 anos de idade.",0.9999999999999988,1.0,0.9999999999,1.0
Quais são as condições para a solicitação de matrícula excepcional?,"['mães   de   crianças   com   até   12   anos   de   idade.   A   solicitação   de   troca   de   turno   de   disciplina   é   realizada   pela   Central   de   Serviços .       16.   Matrícula   e   cancelamento   excepcionais   (Artigos   25   a   27   da   Resolução   ConsEPE   nº   260 )   É   possível   a   solicitação   de   matrícula   excepcional   via   Central   de   Serviços   após   o   ajuste   e   até   5   dias   antes   do   início   das   aulas   se:   I   -   Houve   solicitação   de   matrícula   indeferida   para   a   disciplina   na   primeira   fase   de   matrículas;   II   -   A   matrícula   na   disciplina   não   superar   o   limite   de   créditos   C   =   20', '+   2CA.   III.   -   Não   houver   reprovação   por   frequência   na   disciplina']",As condições para a solicitação de matrícula excepcional são: I - houve solicitação de matrícula indeferida para a disciplina na primeira fase de matrículas; II - a matrícula na disciplina não superar o limite de créditos C = 20 + 2CA; III - não houver reprovação por frequência na disciplina.,As condições para a solicitação de matrícula excepcional são: I - houve solicitação de matrícula indeferida para a disciplina na primeira fase de matrículas; II - a matrícula na disciplina não superar o limite de créditos C = 20 + 2CA; III - não houver reprovação por frequência na disciplina.,1.0000000000000002,1.0,0.99999999995,1.0
