user_input,retrieved_contexts,response,reference,answer_relevancy,faithfulness,context_precision,context_recall
Quando é o período de Lançamento de conceitos de 2024?,['CALENDÁRIO DE PROCEDIMENTOS ADMINISTRATIVO -ACADÊMICOS DA GRADUAÇÃO – 2025 \n \nAtualizado em 20.03.2025  \n1 \n JANEIR O \nDe 06/01 a 07/02  Lançamento de conceitos de 2024.3  \nDe 09 a 23  Avaliação de Disciplinas 3º quadrimestre 2024  \n30 (12h) a 31 (23h59)  Ajuste de Matrículas em Disciplinas - 1º qua...'],De 06/01 a 07/02,De 06/01 a 07/02,0.5532369707113846,1.0,0.9999999999,0.5
Quando é necessário solicitar Colação de Grau?,"['(**) Para solicitar Colação de Grau neste período, é necessário ter concluído todas as exigências previstas nos \nProjetos Pedagógicos dos cursos até a finalização do quadrimestre de 202 4.2, incluindo -se a validação de atividades \ncomplementares e extensionistas . \n \nFEVEREIRO  \n01 Conclusão do 3º ...']",É necessário ter concluído todas as exigências previstas nos Projetos Pedagógicos dos cursos até a finalização do quadrimestre de 2024.2.,É necessário ter concluído todas as exigências previstas nos Projetos Pedagógicos dos cursos até a finalização do quadrimestre de 2024.2.,0.4603669426879473,1.0,0.9999999999,1.0
O que acontece entre 03 e 04?,"['De 03 a 04 Solicitação de Matrícula – Aluno Especial  - 1º quadrimestre de 2025  \nDe 10 a 24  Avaliação de Disciplinas 3º quadrimestre 2024  \n10 Início das Aulas  - 1º quadrimestre (veteranos)  \nDe 10 a 14  Solicitação de matr ícula em Trabalho de Graduação  das Engenharias , Trabalho  de Conclusão ...']",Solicitação de Matrícula – Aluno Especial  - 1º quadrimestre de 2025,Solicitação de Matrícula – Aluno Especial  - 1º quadrimestre de 2025,0.3550399898199161,0.5,0.9999999999,0.25
Quando é a data limite para solicitar colação de grau?,['De 17 a 21  Solicitação de Aproveitamento de Disciplina como Livre Escolha  \nDe 17 a 21  Solicitação de Equivalência de Disciplina  \n18 (12h) a 19 (23h59 ) Reajuste de Matrículas em Disciplinas  - 1º quadrimestre de 202 5 \n28 Colação de Grau – exclusivo para concluintes até o 2º quadrimestre de 2024...'],De 01 a 28,De 01 a 28,0.5261953058481464,0.0,0.9999999999,0.4
Quando é o lançamento de conceitos da recuperação em 2024?,"['(*) Para solicitar Colação de Grau  neste período, é necessário ter concluído todas as exigências previstas nos \nProjetos Pedagógicos dos cursos até a finalização do quadrimestre de 202 4.2, incluindo -se a validação de atividades \ncomplementares e extensionistas . \n \nMARÇO  \nDe 06 a 13  Lançamento ...']",De 06 a 13,De 06 a 13,0.3949649255997831,1.0,0.9999999999,1.0
